{
  "schema_id": "prometheus.tokenizer",
  "schema_version": 1,
  "tokenizer_id": "byte-bpe-128k-r0",
  "algorithm": "byte_fallback_bpe",
  "vocab_size": 128000,
  "byte_fallback": true,
  "special_tokens": {
    "bos": 0,
    "eos": 1,
    "pad": 2,
    "unk": 3,
    "latent": 4
  },
  "arc_grid_token_range": {
    "start": 100,
    "end": 132
  },
  "vocab_hash": "0df1b7fd0b4abcaad1178f510d5c25c432a2fdef64075ff75f5ed9a931d36fed",
  "frozen": true,
  "frozen_at": "2026-09-16T12:00:00Z",
  "corpus_hash": "53f170eae5f5a0a0ac6f176a1f61423d2c2e5f31fda4c021aa3258ab013be8ab"
}
